<?xml version="1.0" encoding="ISO-8859-1"?>
<!DOCTYPE project SYSTEM "../Configuration.dtd">

<project name="Test" numberOfCyclesFeedbackOnConsole="1"
	numberOfCycleAnalysisProgressFeedbackOnConsole="1"
	checkLayerDependencies="true" checkSubsystemDependencies="true"
	checkPackageDependencies="true" cumulateLayerDependencies="true"
	cumulateSubsystemDependencies="true" cumulatePackageDependencies="true"
	cumulateCompilationUnitDependencies="true" cumulateTypeDependencies="true"
	maxLayerCycles="0" maxSubsystemCycles="0" maxPackageCycles="0"
	maxCompilationUnitCycles="0" maxTypeCycles="0">
	<input dir="." />
	<include-package name="application.*" />
	<include-package name="services.*" />
	<listener
		class="com.valtech.source.dependometer.ui.console.output.HtmlWriter"
		args="./results/dependometer" />

	<layer name="Application">
		<subsystem name="core">
			<include-package name="application.core.*" />
			<depends-upon name="Services::shopService"/>
		</subsystem>
		<depends-upon name="Services"/>
	</layer>

	<layer name="Services">
		<subsystem name="shopService">
			<include-package name="services" />
			<include-package name="services.shop" />
			<depends-upon name="Services::catalogueService"/>
		</subsystem>
		<subsystem name="catalogueService">
			<include-package name="services.catalogue" />
			<depends-upon name="Services::catalogueExportService"/>
		</subsystem>
		<subsystem name="catalogueExportService">
			<include-package name="services.catalogue.export" />
			<depends-upon name="External::extern1"/>
		</subsystem>
	</layer>

	<layer name="External">
		<subsystem name="extern1">
			<include-package name="external.sub1" />
		</subsystem>
	</layer>
</project>