<?xml version="1.0" encoding="ISO-8859-1"?>
<!DOCTYPE project SYSTEM "../Configuration.dtd">

<project name="Test" numberOfCyclesFeedbackOnConsole="1"
	numberOfCycleAnalysisProgressFeedbackOnConsole="1"
	checkLayerDependencies="true" checkSubsystemDependencies="true"
	checkPackageDependencies="true" cumulateLayerDependencies="true"
	cumulateSubsystemDependencies="true" cumulatePackageDependencies="true"
	cumulateCompilationUnitDependencies="true" cumulateTypeDependencies="true"
	maxLayerCycles="0" maxSubsystemCycles="0" maxPackageCycles="0"
	maxCompilationUnitCycles="0" maxTypeCycles="0">
	<input dir="." />
	<include-package name="one.*" />
	<include-package name="two.*" />
	<listener
		class="com.valtech.source.dependometer.ui.console.output.HtmlWriter"
		args="./results/dependometer" />

	<!-- LOGICAL ARCHITECTURE -->
	<layer name="One">
		<description>Layer One</description>
		<subsystem name="system1">
			<description>system 1</description>
			<include-package name="one.*" />
		</subsystem>
	</layer>

	<layer name="Two">
		<description>Layer Two</description>
		<subsystem name="system2-1">
			<description>system 2-1</description>
			<include-package name="two" />
			<include-package name="two.sub1" />
		</subsystem>
		<subsystem name="system2-2">
			<description>system 2-2</description>
			<include-package name="two.sub2" />
		</subsystem>
		<subsystem name="system2-2-1">
			<description>system 2-2-1</description>
			<include-package name="two.sub2.subsub1" />
		</subsystem>
	</layer>

	<layer name="External">
		<subsystem name="extern1">
			<description>extern 1</description>
			<include-package name="external.sub1" />
		</subsystem>
	</layer>
</project>